Question,Option 1,Option 2,Option 3,Option 4,Explanation / Rule
We will have to wait _____ the financial audit is complete before making any new hires.,until,by,within,at,"Usa-se ""until"" para indicar uma ação contínua que vai até um determinado momento no futuro (até que)."
The marketing team managed to double their sales _____ the course of just six months.,over,throughout,around,at,"Usa-se ""over"" para indicar que algo aconteceu ao longo ou no decorrer de um período de tempo."
The CEO prefers to hold the annual general meetings _____ the end of the fiscal year.,at,by,about,within,"Usa-se ""at"" para momentos específicos no tempo incluindo expressões fixas como ""at the end of""."
"I can't talk right now but I promise I will call you back _____ an hour.",within,until,by,at,"Usa-se ""within"" para indicar que algo acontecerá antes de um período de tempo terminar (dentro de / em menos de)."
"The flight should land _____ 3 PM give or take ten minutes depending on the wind.",around,by,until,through,"Usa-se ""around"" para indicar horários aproximados (por volta de)."
